{
  "job": {
    "job_id": "",
    "title": "",
    "company": "",
    "description": "",
    "source_url": "",
    "source": "",
    "location": "",
    "work_arrangement": "",
    "seniority": "",
    "application_status": "",
    "interview_stage": "",
    "application_date": "",
    "interview_date": "",
    "posted_compensation": {
      "raw": "",
      "min": null,
      "max": null,
      "currency": "USD",
      "period": "year"
    },
    "extracted_requirements": [],
    "contacts": []
  },
  "resume": {
    "resume_id": "",
    "version": "",
    "label": "",
    "path": "",
    "text": ""
  },
  "candidate": {
    "name": "",
    "target_pay": "",
    "floor_pay": "",
    "strong_win_pay": ""
  },
  "generation": {
    "template_version": "1.0.0"
  }
}
